source_code,food_name,food_name_amharic,food_group,edible_portion,energy_kj,energy_kcal,protein,fat,carbs,fiber,ash,vitamins_minerals_json
030081,"Soybean, whole, dry, roasted (without salt or fat) Yetekola akuri ater",,Legumes and their products,1.0,1780.0,428.0,37.5,20.7,10.1,25.4,4.8,"{""calcium_mg"": 252.0, ""copper_mg"": 1.61, ""iron_mg"": 8.5, ""magnesium_mg"": 266.0, ""manganese_mg"": 2.8, ""phosphorus_mg"": 508.0, ""potassium_mg"": 1890.0, ""selenium_mcg"": 20.0, ""sodium_mg"": 5.0, ""water_g"": 1.5, ""zinc_mg"": 5.14}"
030082,Yetekekele guaya,,Legumes and their products,1.0,373.0,89.0,7.3,0.3,11.4,5.4,0.8,"{""water_g"": 74.8}"
030084,"Field peas, boiled and roasted, without salt Ater endushdush",,Legumes and their products,1.0,719.0,171.0,11.4,1.1,22.7,12.2,1.3,"{""calcium_mg"": 45.0, ""copper_mg"": 0.09, ""iron_mg"": 2.7, ""magnesium_mg"": 52.0, ""manganese_mg"": 0.61, ""phosphorus_mg"": 177.0, ""potassium_mg"": 389.0, ""selenium_mcg"": 27.0, ""sodium_mg"": 5.0, ""water_g"": 51.3, ""zinc_mg"": 1.64}"
030085,"Ye’ater shiro wot, keye",,Legumes and their products,1.0,550.0,133.0,2.1,11.4,4.8,1.3,1.4,"{""water_g"": 79.0}"
030086,"Pea, flour, spiced, stew, thick, with tomato, oil onion, red pepper spice blend, green pepper, Ye’ater shiro tegabino",,Legumes and their products,1.0,796.0,192.0,3.6,15.7,8.1,2.2,1.8,"{""calcium_mg"": 17.0, ""copper_mg"": 0.11, ""iron_mg"": 3.2, ""magnesium_mg"": 21.0, ""manganese_mg"": 0.19, ""phosphorus_mg"": 68.0, ""potassium_mg"": 194.0, ""selenium_mcg"": 1.0, ""sodium_mg"": 388.0, ""water_g"": 68.7, ""zinc_mg"": 0.65}"
030087,"Broad beans, roasted and boiled, without salt Ashuk",,Legumes and their products,1.0,489.0,116.0,10.0,0.5,14.0,7.8,1.1,"{""calcium_mg"": 32.0, ""copper_mg"": 0.22, ""iron_mg"": 2.1, ""magnesium_mg"": 41.0, ""manganese_mg"": 0.55, ""phosphorus_mg"": 143.0, ""potassium_mg"": 325.0, ""selenium_mcg"": 2.0, ""sodium_mg"": 7.0, ""water_g"": 66.6, ""zinc_mg"": 1.35}"
030090,"Ye’ater, shimbra ena tomato, onion, oil, green pepper, red pepper spice",,Legumes and their products,1.0,437.0,105.0,3.0,6.9,6.7,1.8,2.1,"{""calcium_mg"": 14.0, ""copper_mg"": 0.11, ""iron_mg"": 2.4, ""magnesium_mg"": 20.0, ""manganese_mg"": 0.21, ""phosphorus_mg"": 61.0, ""potassium_mg"": 168.0, ""selenium_mcg"": 2.0, ""sodium_mg"": 549.0, ""water_g"": 79.4, ""zinc_mg"": 0.57}"
030091,"Ye’ater, shimbra ena thick, with tomato, oil, onion, green pepper, salt and",,Legumes and their products,1.0,652.0,157.0,3.9,11.5,8.4,2.1,1.6,"{""calcium_mg"": 17.0, ""copper_mg"": 0.13, ""iron_mg"": 3.2, ""magnesium_mg"": 23.0, ""manganese_mg"": 0.26, ""phosphorus_mg"": 78.0, ""potassium_mg"": 200.0, ""selenium_mcg"": 2.0, ""sodium_mg"": 344.0, ""water_g"": 72.5, ""zinc_mg"": 0.74}"
030092,"Misir kik wot, alicha",,Legumes and their products,1.0,598.0,144.0,5.9,8.4,9.9,2.4,1.4,"{""water_g"": 72.0}"
030093,"Misir kik wot, keye",,Legumes and their products,1.0,546.0,131.0,5.5,7.3,9.4,2.7,1.9,"{""water_g"": 73.2}"
030094,"Ater kik wot, alicha",,Legumes and their products,1.0,693.0,166.0,7.4,8.5,13.3,3.5,1.7,"{""water_g"": 65.7}"
030097,"Difin misir wot, keye",,Legumes and their products,1.0,517.0,124.0,5.4,6.2,9.5,4.4,2.1,"{""water_g"": 72.5}"
030098,Ye' boloke wot,,Legumes and their products,1.0,511.0,122.0,6.0,4.7,11.1,5.8,2.5,"{""water_g"": 69.9}"
030099,Shiro wot be'enqulale,,Legumes and their products,1.0,455.0,110.0,3.0,8.2,5.3,1.4,1.2,"{""water_g"": 80.9}"
030100,"Difin misir wot, alicha",,Legumes and their products,1.0,627.0,150.0,7.0,7.4,11.6,4.7,1.9,"{""water_g"": 67.5}"
030102,Azifa,,Legumes and their products,1.0,511.0,122.0,6.6,4.7,11.1,4.4,2.0,"{""water_g"": 71.2}"
030105,Ye’shimbra shiro tegabino,,Legumes and their products,1.0,691.0,167.0,3.3,13.1,7.9,2.2,1.5,"{""water_g"": 72.1}"
030106,Ye’shimbra asa wot,,Legumes and their products,1.0,921.0,221.0,7.5,13.4,15.0,5.5,2.6,"{""water_g"": 56.1}"
040002,"Beetroot, peeled, raw Yetelate keysir, ti're",,Vegetables and their products,0.85,185.0,44.0,2.2,0.1,6.9,3.3,1.4,"{""calcium_mg"": 17.0, ""copper_mg"": 0.12, ""iron_mg"": 0.8, ""magnesium_mg"": 11.0, ""manganese_mg"": 0.57, ""phosphorus_mg"": 36.0, ""potassium_mg"": 306.0, ""selenium_mcg"": 0.0, ""sodium_mg"": 60.0, ""water_g"": 86.1, ""zinc_mg"": 0.3}"
040003,"Cabbage, white, raw Tikil gomen, ti're",,Vegetables and their products,0.96,114.0,27.0,1.1,0.1,4.3,2.3,0.5,"{""calcium_mg"": 31.0, ""copper_mg"": 0.01, ""iron_mg"": 0.4, ""magnesium_mg"": 12.0, ""manganese_mg"": 0.2, ""phosphorus_mg"": 22.0, ""potassium_mg"": 154.0, ""selenium_mcg"": 2.0, ""sodium_mg"": 16.0, ""water_g"": 91.6, ""zinc_mg"": 0.15}"
040004,"Carrot, peeled, raw Yetelate carot, ti're",,Vegetables and their products,0.72,139.0,33.0,1.6,0.4,4.2,3.2,0.9,"{""calcium_mg"": 31.0, ""copper_mg"": 0.07, ""iron_mg"": 1.3, ""magnesium_mg"": 10.0, ""manganese_mg"": 0.23, ""phosphorus_mg"": 33.0, ""potassium_mg"": 209.0, ""selenium_mcg"": 0.0, ""sodium_mg"": 35.0, ""water_g"": 89.7, ""zinc_mg"": 0.3}"
040005,"Cauliflower, top and stems, raw Abeba gomen, ti're",,Vegetables and their products,0.7,90.0,22.0,2.7,0.2,0.4,3.7,0.9,"{""calcium_mg"": 30.0, ""copper_mg"": 0.07, ""iron_mg"": 0.8, ""magnesium_mg"": 11.0, ""manganese_mg"": 0.23, ""phosphorus_mg"": 62.0, ""potassium_mg"": 304.0, ""selenium_mcg"": 0.0, ""sodium_mg"": 12.0, ""water_g"": 92.1, ""zinc_mg"": 0.32}"
040006,"Celery, leaves, raw Ye'shorba kitel, ti're",,Vegetables and their products,0.22,167.0,40.0,3.3,0.5,3.7,3.9,2.0,"{""calcium_mg"": 317.0, ""copper_mg"": 0.02, ""iron_mg"": 5.2, ""magnesium_mg"": 58.0, ""manganese_mg"": 0.54, ""phosphorus_mg"": 52.0, ""potassium_mg"": 137.0, ""selenium_mcg"": 2.0, ""sodium_mg"": 83.0, ""water_g"": 86.7, ""zinc_mg"": 0.5}"
040007,"Cucumber, raw Cucumber, ti're",,Vegetables and their products,0.94,32.0,8.0,0.6,0.1,0.1,2.1,0.5,"{""calcium_mg"": 8.0, ""copper_mg"": 0.03, ""iron_mg"": 0.3, ""magnesium_mg"": 12.0, ""manganese_mg"": 0.08, ""phosphorus_mg"": 20.0, ""potassium_mg"": 134.0, ""selenium_mcg"": 0.0, ""sodium_mg"": 10.0, ""water_g"": 96.6, ""zinc_mg"": 0.17}"
040008,"Ethiopian Kale, leaves, raw Ye'habesha gomen, ti're",,Vegetables and their products,0.52,157.0,38.0,4.2,0.3,2.1,4.6,2.3,"{""calcium_mg"": 424.0, ""copper_mg"": 0.05, ""iron_mg"": 5.7, ""magnesium_mg"": 52.0, ""manganese_mg"": 1.27, ""phosphorus_mg"": 57.0, ""potassium_mg"": 499.0, ""selenium_mcg"": 2.0, ""sodium_mg"": 30.0, ""water_g"": 86.5, ""zinc_mg"": 0.65}"
040009,"Garlic, fresh, raw Nech shinkurt, ti're",,Vegetables and their products,0.85,554.0,131.0,6.5,0.3,23.1,5.2,1.4,"{""calcium_mg"": 49.0, ""copper_mg"": 0.19, ""iron_mg"": 2.1, ""magnesium_mg"": 27.0, ""manganese_mg"": 0.34, ""phosphorus_mg"": 143.0, ""potassium_mg"": 430.0, ""selenium_mcg"": 0.0, ""sodium_mg"": 9.0, ""water_g"": 63.6, ""zinc_mg"": 0.89}"
040010,"Pumpkin, leaves, fresh, raw Ye'dubba kitel, ti're",,Vegetables and their products,0.82,156.0,37.0,4.2,0.7,2.3,2.3,3.2,"{""calcium_mg"": 383.0, ""copper_mg"": 0.13, ""iron_mg"": 2.2, ""magnesium_mg"": 142.0, ""manganese_mg"": 1.14, ""phosphorus_mg"": 119.0, ""potassium_mg"": 500.0, ""selenium_mcg"": 1.0, ""sodium_mg"": 11.0, ""water_g"": 87.3, ""zinc_mg"": 0.9}"
040011,"Ginger, root, peeled, fresh, raw Yetelate zingibel, ti're",,Vegetables and their products,0.94,370.0,88.0,2.6,1.2,13.0,7.6,2.0,"{""calcium_mg"": 19.0, ""copper_mg"": 0.12, ""iron_mg"": 1.9, ""magnesium_mg"": 38.0, ""manganese_mg"": 5.43, ""phosphorus_mg"": 55.0, ""potassium_mg"": 758.0, ""selenium_mcg"": 0.0, ""sodium_mg"": 18.0, ""water_g"": 73.6, ""zinc_mg"": 0.35}"
040012,"Eggplant, fruit, raw Deberjan, ti're",,Vegetables and their products,0.91,112.0,27.0,1.2,0.3,2.8,4.0,0.9,"{""calcium_mg"": 18.0, ""copper_mg"": 0.22, ""iron_mg"": 1.4, ""magnesium_mg"": 8.0, ""manganese_mg"": 0.17, ""phosphorus_mg"": 35.0, ""potassium_mg"": 200.0, ""selenium_mcg"": 0.0, ""sodium_mg"": 3.0, ""water_g"": 90.8, ""zinc_mg"": 0.28}"
040013,"Green onion, bulb and stem, fresh, raw Baro shinkurt, ti're",,Vegetables and their products,0.78,145.0,34.0,2.2,0.2,5.0,1.9,0.9,"{""calcium_mg"": 38.0, ""copper_mg"": 0.06, ""iron_mg"": 2.1, ""magnesium_mg"": 11.0, ""manganese_mg"": 0.22, ""phosphorus_mg"": 30.0, ""potassium_mg"": 303.0, ""selenium_mcg"": 1.0, ""sodium_mg"": 5.0, ""water_g"": 89.8, ""zinc_mg"": 0.24}"
040014,"Leek, bulb and stem, raw Baro shinkurt, ti're",,Vegetables and their products,0.54,220.0,52.0,1.9,0.6,8.3,3.1,0.8,"{""calcium_mg"": 60.0, ""copper_mg"": 0.12, ""iron_mg"": 1.5, ""magnesium_mg"": 28.0, ""manganese_mg"": 0.36, ""phosphorus_mg"": 41.0, ""potassium_mg"": 202.0, ""selenium_mcg"": 0.0, ""sodium_mg"": 20.0, ""water_g"": 85.3, ""zinc_mg"": 0.12}"
040015,"Lettuce, raw Ye'selata kitel, ti're",,Vegetables and their products,0.94,56.0,13.0,1.0,0.2,1.0,1.8,0.5,"{""calcium_mg"": 22.0, ""copper_mg"": 0.06, ""iron_mg"": 1.6, ""magnesium_mg"": 8.0, ""manganese_mg"": 0.38, ""phosphorus_mg"": 31.0, ""potassium_mg"": 230.0, ""selenium_mcg"": 6.0, ""sodium_mg"": 12.0, ""water_g"": 95.5, ""zinc_mg"": 0.25}"
040016,"Moringa, leaves, raw Ye'moringa kitel, ti're",,Vegetables and their products,0.62,327.0,78.0,7.0,0.8,7.4,6.9,3.1,"{""calcium_mg"": 621.0, ""copper_mg"": 0.08, ""iron_mg"": 10.6, ""magnesium_mg"": 131.0, ""manganese_mg"": 1.26, ""phosphorus_mg"": 65.0, ""potassium_mg"": 443.0, ""selenium_mcg"": 29.0, ""sodium_mg"": 59.0, ""water_g"": 74.9, ""zinc_mg"": 0.53}"
040017,"Mushrooms, oyster, stem and cap, raw Mushroom, ti're",,Vegetables and their products,0.92,184.0,44.0,4.3,0.4,4.5,2.3,1.0,"{""calcium_mg"": 6.0, ""copper_mg"": 0.36, ""iron_mg"": 0.7, ""magnesium_mg"": 20.0, ""manganese_mg"": 0.11, ""phosphorus_mg"": 187.0, ""potassium_mg"": 516.0, ""selenium_mcg"": 3.0, ""sodium_mg"": 31.0, ""water_g"": 87.4, ""zinc_mg"": 0.8}"
040018,"Onion, peeled, raw Keye shinkurt, yetelate, ti're",,Vegetables and their products,0.89,154.0,37.0,1.1,0.2,6.3,2.5,0.6,"{""calcium_mg"": 25.0, ""copper_mg"": 0.14, ""iron_mg"": 0.7, ""magnesium_mg"": 12.0, ""manganese_mg"": 0.24, ""phosphorus_mg"": 44.0, ""potassium_mg"": 162.0, ""selenium_mcg"": 0.0, ""sodium_mg"": 10.0, ""water_g"": 89.3, ""zinc_mg"": 0.28}"
040019,"Okra, raw Okra, ti're",,Vegetables and their products,0.82,159.0,38.0,2.5,0.2,4.5,4.1,1.1,"{""calcium_mg"": 105.0, ""copper_mg"": 0.11, ""iron_mg"": 0.8, ""magnesium_mg"": 77.0, ""manganese_mg"": 0.3, ""phosphorus_mg"": 74.0, ""potassium_mg"": 184.0, ""selenium_mcg"": 0.0, ""sodium_mg"": 8.0, ""water_g"": 87.6, ""zinc_mg"": 0.68}"
040020,"Onion, shallot, peeled, raw",,Vegetables and their products,0.72,292.0,69.0,1.6,0.1,14.8,1.2,0.9,"{""calcium_mg"": 41.0, ""copper_mg"": 0.07, ""iron_mg"": 0.8, ""magnesium_mg"": 15.0, ""manganese_mg"": 0.11, ""phosphorus_mg"": 52.0, ""potassium_mg"": 160.0, ""selenium_mcg"": 1.0, ""sodium_mg"": 4.0, ""water_g"": 81.4, ""zinc_mg"": 0.3}"
040021,"Pepper, sweet, red, fresh, raw Keye kariya, ti're",,Vegetables and their products,0.82,203.0,28.0,2.0,0.8,7.0,2.5,0.8,"{""calcium_mg"": 22.0, ""copper_mg"": 0.07, ""iron_mg"": 2.2, ""magnesium_mg"": 20.0, ""manganese_mg"": 0.24, ""phosphorus_mg"": 50.0, ""potassium_mg"": 177.0, ""selenium_mcg"": 0.0, ""sodium_mg"": 10.0, ""water_g"": 86.9, ""zinc_mg"": 0.12}"
040022,"Pepper, sweet, green, fresh, raw Kariya, ti're",,Vegetables and their products,0.82,175.0,42.0,1.9,0.5,6.2,2.4,0.9,"{""calcium_mg"": 15.0, ""copper_mg"": 0.17, ""iron_mg"": 1.5, ""magnesium_mg"": 10.0, ""manganese_mg"": 0.1, ""phosphorus_mg"": 23.0, ""potassium_mg"": 177.0, ""selenium_mcg"": 0.0, ""sodium_mg"": 10.0, ""water_g"": 88.1, ""zinc_mg"": 0.24}"
040024,"Pumpkin, flesh, raw Dubba, ti're",,Vegetables and their products,0.72,159.0,38.0,1.3,0.2,6.6,2.4,0.9,"{""calcium_mg"": 22.0, ""copper_mg"": 0.09, ""iron_mg"": 1.8, ""magnesium_mg"": 12.0, ""manganese_mg"": 0.08, ""phosphorus_mg"": 41.0, ""potassium_mg"": 280.0, ""selenium_mcg"": 0.0, ""sodium_mg"": 6.0, ""water_g"": 88.7, ""zinc_mg"": 0.24}"
040025,"Raddish, raw Fijil, ti're",,Vegetables and their products,0.68,72.0,17.0,1.1,0.1,1.6,2.7,1.3,"{""calcium_mg"": 48.0, ""copper_mg"": 0.03, ""iron_mg"": 0.7, ""magnesium_mg"": 16.0, ""manganese_mg"": 0.1, ""phosphorus_mg"": 46.0, ""potassium_mg"": 288.0, ""selenium_mcg"": 0, ""sodium_mg"": 28.0, ""water_g"": 93.2, ""zinc_mg"": 0.22}"
040026,"Green beans, fresh, raw Foseliya, ti're",,Vegetables and their products,0.92,155.0,37.0,2.0,0.3,5.1,2.8,1.2,"{""calcium_mg"": 41.0, ""copper_mg"": 0.11, ""iron_mg"": 1.2, ""magnesium_mg"": 24.0, ""manganese_mg"": 0.14, ""phosphorus_mg"": 75.0, ""potassium_mg"": 250.0, ""selenium_mcg"": 0.0, ""sodium_mg"": 4.0, ""water_g"": 88.6, ""zinc_mg"": 0.2}"
040027,"Spinach, leaves, raw Spinach, ti're",,Vegetables and their products,0.85,196.0,47.0,5.6,0.4,3.8,2.7,4.2,"{""calcium_mg"": 122.0, ""copper_mg"": 0.13, ""iron_mg"": 2.7, ""magnesium_mg"": 79.0, ""manganese_mg"": 1.12, ""phosphorus_mg"": 49.0, ""potassium_mg"": 558.0, ""selenium_mcg"": 2.0, ""sodium_mg"": 79.0, ""water_g"": 83.3, ""zinc_mg"": 0.53}"
040028,"Squash, fresh, raw Squash, ti're",,Vegetables and their products,0.64,92.0,22.0,1.3,0.1,3.4,1.0,0.5,"{""calcium_mg"": 17.0, ""copper_mg"": 0.09, ""iron_mg"": 0.5, ""magnesium_mg"": 20.0, ""manganese_mg"": 0.17, ""phosphorus_mg"": 39.0, ""potassium_mg"": 222.0, ""selenium_mcg"": 0.0, ""sodium_mg"": 2.0, ""water_g"": 93.7, ""zinc_mg"": 0.29}"
040029,"Swiss chard, leaves, raw Kosta, ti're",,Vegetables and their products,0.5,80.0,19.0,2.2,0.2,0.4,3.6,2.1,"{""calcium_mg"": 85.0, ""copper_mg"": 0.18, ""iron_mg"": 3.6, ""magnesium_mg"": 78.0, ""manganese_mg"": 0.37, ""phosphorus_mg"": 41.0, ""potassium_mg"": 348.0, ""selenium_mcg"": 1.0, ""sodium_mg"": 213.0, ""water_g"": 91.5, ""zinc_mg"": 0.36}"
040030,"Tomato, red, ripe, raw Timatim, ti're",,Vegetables and their products,0.98,108.0,26.0,1.3,0.3,3.9,1.4,0.7,"{""calcium_mg"": 9.0, ""copper_mg"": 0.04, ""iron_mg"": 0.9, ""magnesium_mg"": 13.0, ""manganese_mg"": 0.09, ""phosphorus_mg"": 29.0, ""potassium_mg"": 235.0, ""selenium_mcg"": 0.0, ""sodium_mg"": 13.0, ""water_g"": 92.5, ""zinc_mg"": 0.22}"
040031,"Tomato, paste, canned Timatim, dilih, yetashege",,Vegetables and their products,1.0,594.0,142.0,4.3,3.8,19.7,5.7,3.8,"{""calcium_mg"": 49.0, ""copper_mg"": 0.85, ""iron_mg"": 1.3, ""magnesium_mg"": 74.0, ""manganese_mg"": 0.49, ""phosphorus_mg"": 114.0, ""potassium_mg"": 1350.0, ""selenium_mcg"": 1.0, ""sodium_mg"": 49.0, ""water_g"": 62.8, ""zinc_mg"": 1.16}"
040032,"Mustard, leaves, fresh, raw Ye'senafich kitel, ti're",,Vegetables and their products,0.93,151.0,36.0,3.5,0.5,2.4,3.9,1.5,"{""calcium_mg"": 191.0, ""copper_mg"": 0.24, ""iron_mg"": 2.8, ""magnesium_mg"": 52.0, ""manganese_mg"": 0.41, ""phosphorus_mg"": 72.0, ""potassium_mg"": 403.0, ""selenium_mcg"": 8.0, ""sodium_mg"": 19.0, ""water_g"": 88.2, ""zinc_mg"": 0.68}"
040033,"Broccoli, tops and stems, fresh, raw Broccoli, ti're",,Vegetables and their products,0.6,143.0,34.0,3.3,0.3,2.7,3.7,1.0,"{""calcium_mg"": 66.0, ""copper_mg"": 0.05, ""iron_mg"": 0.8, ""magnesium_mg"": 21.0, ""manganese_mg"": 0.21, ""phosphorus_mg"": 75.0, ""potassium_mg"": 336.0, ""selenium_mcg"": 0.0, ""sodium_mg"": 22.0, ""water_g"": 89.0, ""zinc_mg"": 0.6}"
040034,"Beetroot, peeled, boiled, drained (without salt) Yetekekele keysir",,Vegetables and their products,0.85,187.0,44.0,2.2,0.1,7.0,3.3,1.4,"{""calcium_mg"": 17.0, ""copper_mg"": 0.12, ""iron_mg"": 0.6, ""magnesium_mg"": 7.0, ""manganese_mg"": 0.52, ""phosphorus_mg"": 33.0, ""potassium_mg"": 139.0, ""selenium_mcg"": 0.0, ""sodium_mg"": 33.0, ""water_g"": 86.0, ""zinc_mg"": 0.23}"
040037,Yetekekele broccoli,,Vegetables and their products,0.63,129.0,31.0,3.0,0.3,2.4,3.3,0.9,"{""water_g"": 90.1}"
040040,"Cabbage, white, boiled, drained (without salt) Yetekekele tikil gomen",,Vegetables and their products,0.96,116.0,28.0,1.2,0.1,4.4,2.4,0.5,"{""calcium_mg"": 30.0, ""copper_mg"": 0.01, ""iron_mg"": 0.3, ""magnesium_mg"": 7.0, ""manganese_mg"": 0.18, ""phosphorus_mg"": 20.0, ""potassium_mg"": 78.0, ""selenium_mcg"": 2.0, ""sodium_mg"": 13.0, ""water_g"": 91.5, ""zinc_mg"": 0.12}"
040043,"Carrot, peeled, boiled, drained (without salt) Teleto yetekekele carot",,Vegetables and their products,0.71,148.0,35.0,1.7,0.4,4.5,3.4,1.0,"{""calcium_mg"": 31.0, ""copper_mg"": 0.07, ""iron_mg"": 1.0, ""magnesium_mg"": 6.0, ""manganese_mg"": 0.22, ""phosphorus_mg"": 32.0, ""potassium_mg"": 100.0, ""selenium_mcg"": 0.0, ""sodium_mg"": 21.0, ""water_g"": 89.0, ""zinc_mg"": 0.24}"
040048,"Celery, leaves, boiled, drained (without salt) Yetekekele ye'shorba kitel",,Vegetables and their products,0.23,161.0,38.0,3.1,0.5,3.5,3.8,1.9,"{""calcium_mg"": 290.0, ""copper_mg"": 0.02, ""iron_mg"": 3.8, ""magnesium_mg"": 34.0, ""manganese_mg"": 0.47, ""phosphorus_mg"": 45.0, ""potassium_mg"": 66.0, ""selenium_mcg"": 2.0, ""sodium_mg"": 60.0, ""water_g"": 87.2, ""zinc_mg"": 0.36}"
040052,"Eggplant, fruit, boiled, drained (without salt) Yetekekele deberjan",,Vegetables and their products,0.9,120.0,29.0,1.3,0.3,3.0,4.3,1.0,"{""calcium_mg"": 18.0, ""copper_mg"": 0.23, ""iron_mg"": 1.1, ""magnesium_mg"": 5.0, ""manganese_mg"": 0.17, ""phosphorus_mg"": 34.0, ""potassium_mg"": 108.0, ""selenium_mcg"": 0.0, ""sodium_mg"": 2.0, ""water_g"": 90.1, ""zinc_mg"": 0.23}"
040057,Yetekekele mushroom,,Vegetables and their products,0.89,252.0,60.0,5.9,0.6,6.2,3.2,1.4,"{""water_g"": 82.8}"
040058,"Onion, peeled, boiled, drained (without salt) Yetekekele keye shinkurt",,Vegetables and their products,0.87,188.0,45.0,1.3,0.3,7.7,3.0,0.7,"{""calcium_mg"": 29.0, ""copper_mg"": 0.16, ""iron_mg"": 0.6, ""magnesium_mg"": 9.0, ""manganese_mg"": 0.26, ""phosphorus_mg"": 48.0, ""potassium_mg"": 89.0, ""selenium_mcg"": 0.0, ""sodium_mg"": 7.0, ""water_g"": 87.0, ""zinc_mg"": 0.26}"
040060,"Okra, boiled, drained (without salt) Yetekekele okra",,Vegetables and their products,0.83,145.0,35.0,2.3,0.2,4.1,3.7,1.0,"{""calcium_mg"": 91.0, ""copper_mg"": 0.1, ""iron_mg"": 0.5, ""magnesium_mg"": 42.0, ""manganese_mg"": 0.25, ""phosphorus_mg"": 61.0, ""potassium_mg"": 84.0, ""selenium_mcg"": 0.0, ""sodium_mg"": 5.0, ""water_g"": 88.7, ""zinc_mg"": 0.46}"
040061,"Okra, boiled, as part of recipe (without salt) Yetekekele okra kenewuhaw",,Vegetables and their products,0.83,145.0,35.0,2.3,0.2,4.1,3.7,1.0,"{""calcium_mg"": 96.0, ""copper_mg"": 0.1, ""iron_mg"": 0.7, ""magnesium_mg"": 70.0, ""manganese_mg"": 0.27, ""phosphorus_mg"": 67.0, ""potassium_mg"": 168.0, ""selenium_mcg"": 0.0, ""sodium_mg"": 7.0, ""water_g"": 88.7, ""zinc_mg"": 0.62}"
040064,"Pumpkin, flesh, boiled, drained (without salt) Yetekekele dubba",,Vegetables and their products,0.7,173.0,41.0,1.4,0.2,7.1,2.6,1.0,"{""calcium_mg"": 23.0, ""copper_mg"": 0.09, ""iron_mg"": 1.5, ""magnesium_mg"": 8.0, ""manganese_mg"": 0.08, ""phosphorus_mg"": 40.0, ""potassium_mg"": 152.0, ""selenium_mcg"": 0.0, ""sodium_mg"": 5.0, ""water_g"": 87.7, ""zinc_mg"": 0.2}"
040065,"Pumpkin, flesh, boiled, as part of a recipe (without salt) Yetekekele dubba kenewuhaw",,Vegetables and their products,0.7,173.0,41.0,1.4,0.2,7.1,2.6,1.0,"{""calcium_mg"": 24.0, ""copper_mg"": 0.1, ""iron_mg"": 2.0, ""magnesium_mg"": 13.0, ""manganese_mg"": 0.09, ""phosphorus_mg"": 45.0, ""potassium_mg"": 304.0, ""selenium_mcg"": 0.0, ""sodium_mg"": 7.0, ""water_g"": 87.7, ""zinc_mg"": 0.26}"
040067,"Squash, fresh, boiled, drained (without salt) Yetekekele squash",,Vegetables and their products,0.62,100.0,24.0,1.4,0.1,3.7,1.1,0.5,"{""calcium_mg"": 18.0, ""copper_mg"": 0.1, ""iron_mg"": 0.4, ""magnesium_mg"": 13.0, ""manganese_mg"": 0.17, ""phosphorus_mg"": 38.0, ""potassium_mg"": 121.0, ""selenium_mcg"": 0.0, ""sodium_mg"": 2.0, ""water_g"": 93.2, ""zinc_mg"": 0.24}"
040068,"Squash, fresh, boiled, as part of a recipe (without salt) Yetekekele squash kenewuhaw",,Vegetables and their products,0.62,100.0,24.0,1.4,0.1,3.7,1.1,0.5,"{""calcium_mg"": 19.0, ""copper_mg"": 0.1, ""iron_mg"": 0.5, ""magnesium_mg"": 22.0, ""manganese_mg"": 0.19, ""phosphorus_mg"": 42.0, ""potassium_mg"": 241.0, ""selenium_mcg"": 0.0, ""sodium_mg"": 2.0, ""water_g"": 93.2, ""zinc_mg"": 0.32}"
040070,"Green beans, fresh, boiled, drained (without salt) Yetekekele foseliya",,Vegetables and their products,0.91,166.0,40.0,2.2,0.3,5.5,3.0,1.3,"{""calcium_mg"": 42.0, ""copper_mg"": 0.11, ""iron_mg"": 1.0, ""magnesium_mg"": 16.0, ""manganese_mg"": 0.14, ""phosphorus_mg"": 73.0, ""potassium_mg"": 134.0, ""selenium_mcg"": 0.0, ""sodium_mg"": 3.0, ""water_g"": 87.7, ""zinc_mg"": 0.16}"
040073,"Spinach, leaves, boiled, drained (without salt) Yetekekele spinach",,Vegetables and their products,0.84,207.0,49.0,5.9,0.4,4.0,2.8,4.4,"{""calcium_mg"": 122.0, ""copper_mg"": 0.13, ""iron_mg"": 2.1, ""magnesium_mg"": 50.0, ""manganese_mg"": 1.06, ""phosphorus_mg"": 46.0, ""potassium_mg"": 294.0, ""selenium_mcg"": 2.0, ""sodium_mg"": 62.0, ""water_g"": 82.4, ""zinc_mg"": 0.42}"
040074,"Spinach, leaves, boiled, as part of recipe (without salt) Yetekekele spinach kenewuhaw",,Vegetables and their products,0.84,207.0,49.0,5.9,0.4,4.0,2.8,4.4,"{""calcium_mg"": 125.0, ""copper_mg"": 0.13, ""iron_mg"": 2.4, ""magnesium_mg"": 69.0, ""manganese_mg"": 1.12, ""phosphorus_mg"": 49.0, ""potassium_mg"": 458.0, ""selenium_mcg"": 2.0, ""sodium_mg"": 72.0, ""water_g"": 82.4, ""zinc_mg"": 0.49}"
040076,"Swiss chard, leaves, boiled, drained (without salt) Yetekekele kosta",,Vegetables and their products,0.48,88.0,21.0,2.4,0.2,0.5,4.0,2.3,"{""calcium_mg"": 89.0, ""copper_mg"": 0.19, ""iron_mg"": 3.0, ""magnesium_mg"": 51.0, ""manganese_mg"": 0.36, ""phosphorus_mg"": 41.0, ""potassium_mg"": 191.0, ""selenium_mcg"": 1.0, ""sodium_mg"": 176.0, ""water_g"": 90.7, ""zinc_mg"": 0.3}"
040077,Yetekekele kosta kenewuhaw,,Vegetables and their products,0.48,88.0,21.0,2.4,0.2,0.5,4.0,2.3,"{""water_g"": 90.7}"
040078,"Tomato, ripe, boiled, drained (without salt) Yetekekele timatim",,Vegetables and their products,0.98,138.0,33.0,1.6,0.3,5.0,1.8,0.9,"{""calcium_mg"": 11.0, ""copper_mg"": 0.05, ""iron_mg"": 0.9, ""magnesium_mg"": 10.0, ""manganese_mg"": 0.1, ""phosphorus_mg"": 34.0, ""potassium_mg"": 151.0, ""selenium_mcg"": 0.0, ""sodium_mg"": 13.0, ""water_g"": 90.4, ""zinc_mg"": 0.21}"
040079,"Tomato, ripe, boiled, as part of a recipe (without salt)",,Vegetables and their products,0.98,138.0,33.0,1.6,0.3,5.0,1.8,0.9,"{""calcium_mg"": 12.0, ""copper_mg"": 0.05, ""iron_mg"": 1.2, ""magnesium_mg"": 17.0, ""manganese_mg"": 0.12, ""phosphorus_mg"": 37.0, ""potassium_mg"": 301.0, ""selenium_mcg"": 0.0, ""sodium_mg"": 17.0, ""water_g"": 90.4, ""zinc_mg"": 0.28}"
040080,Selata,,Vegetables and their products,1.0,550.0,133.0,1.1,12.3,3.6,1.7,2.1,"{""water_g"": 79.2}"
040081,Selata be'avocado,,Vegetables and their products,1.0,586.0,142.0,1.1,12.8,4.5,2.4,1.7,"{""water_g"": 77.6}"
040082,Timatim lebeleb,,Vegetables and their products,1.0,575.0,139.0,1.4,12.1,5.0,2.1,1.9,"{""water_g"": 77.5}"
040083,"Salad from tomato, onion, oil, green pepper and salt Timatim kurit",,Vegetables and their products,1.0,447.0,108.0,1.1,9.4,4.1,1.5,2.4,"{""calcium_mg"": 11.0, ""copper_mg"": 0.08, ""iron_mg"": 0.8, ""magnesium_mg"": 16.0, ""manganese_mg"": 0.1, ""phosphorus_mg"": 27.0, ""potassium_mg"": 192.0, ""selenium_mcg"": 0.0, ""sodium_mg"": 704.0, ""water_g"": 81.6, ""zinc_mg"": 0.2}"
040084,Seneg Qarya,,Vegetables and their products,1.0,493.0,119.0,1.4,10.0,5.0,1.9,1.9,"{""water_g"": 79.8}"
040085,Tikile gomen be'carot,,Vegetables and their products,1.0,473.0,114.0,1.6,8.7,5.7,3.1,2.0,"{""water_g"": 78.8}"
040087,Dinch be'tikil gomen,,Vegetables and their products,1.0,476.0,114.0,1.7,6.6,10.9,2.1,3.0,"{""water_g"": 75.7}"
040090,Foseliya be'carot,,Vegetables and their products,1.0,986.0,238.0,3.1,19.8,9.4,5.0,3.8,"{""water_g"": 58.9}"
040092,Zelbo Gommen,,Vegetables and their products,1.0,749.0,182.0,3.8,16.1,3.2,4.3,3.4,"{""water_g"": 69.3}"
040093,Gomen be'siga,,Vegetables and their products,1.0,889.0,215.0,6.3,19.2,3.0,2.6,3.0,"{""water_g"": 65.8}"
040094,Gomen kitfo,,Vegetables and their products,1.0,1300.0,315.0,9.2,25.5,6.8,10.6,5.6,"{""water_g"": 42.3}"
040096,"Bamiya, alicha",,Vegetables and their products,1.0,509.0,123.0,1.9,10.3,4.2,2.9,1.8,"{""water_g"": 78.8}"
050004,"Lemon, fresh, pulp (flesh), raw Lomi",,Fruits and their products,1.0,183.0,44.0,0.6,0.9,7.0,2.5,0.5,"{""calcium_mg"": 41.0, ""copper_mg"": 0.12, ""iron_mg"": 0.5, ""magnesium_mg"": 15.0, ""manganese_mg"": 0.02, ""phosphorus_mg"": 17.0, ""potassium_mg"": 157.0, ""selenium_mcg"": 0.0, ""sodium_mg"": 2.0, ""water_g"": 88.5, ""zinc_mg"": 0.1}"
050008,"Lime, fresh, pulp (flesh), raw Ye'habesha lomi",,Fruits and their products,0.64,176.0,42.0,0.6,0.2,8.3,2.1,0.5,"{""calcium_mg"": 44.0, ""copper_mg"": 0.07, ""iron_mg"": 0.8, ""magnesium_mg"": 6.0, ""manganese_mg"": 0.04, ""phosphorus_mg"": 24.0, ""potassium_mg"": 102.0, ""selenium_mcg"": 1.0, ""sodium_mg"": 2.0, ""water_g"": 88.3, ""zinc_mg"": 0.11}"
050010,"Date, dry, mature, raw Temir",,Fruits and their products,0.84,1320.0,312.0,2.4,0.5,70.3,8.4,1.9,"{""calcium_mg"": 68.0, ""copper_mg"": 0.34, ""iron_mg"": 3.8, ""magnesium_mg"": 53.0, ""manganese_mg"": 0.77, ""phosphorus_mg"": 71.0, ""potassium_mg"": 562.0, ""selenium_mcg"": 1.0, ""sodium_mg"": 9.0, ""water_g"": 16.4, ""zinc_mg"": 0.66}"
050011,"Fig, fresh, raw Sholla",,Fruits and their products,0.99,174.0,41.0,0.8,0.3,7.8,2.3,0.8,"{""calcium_mg"": 29.0, ""copper_mg"": 0.04, ""iron_mg"": 0.9, ""magnesium_mg"": 14.0, ""manganese_mg"": 0.03, ""phosphorus_mg"": 17.0, ""potassium_mg"": 134.0, ""selenium_mcg"": 0.0, ""sodium_mg"": 2.0, ""water_g"": 88.1, ""zinc_mg"": 0.15}"
050012,"Orange, pulp, raw Birtukan",,Fruits and their products,0.75,179.0,43.0,0.9,0.4,7.3,3.1,0.7,"{""calcium_mg"": 23.0, ""copper_mg"": 0.03, ""iron_mg"": 0.2, ""magnesium_mg"": 10.0, ""manganese_mg"": 0.02, ""phosphorus_mg"": 13.0, ""potassium_mg"": 165.0, ""selenium_mcg"": 0.0, ""sodium_mg"": 5.0, ""water_g"": 87.6, ""zinc_mg"": 0.05}"
